Category;ID;Keyword;Content;Image_File
Horoscope;H_PI_139;위로의 말;오늘 물고기자리는 완벽한 위로의 말로 상처를 치유합니다. 위로하세요. 말이 약입니다.;horoscope_pisces.png
Horoscope;H_PI_140;대리만족;물고기자리가 타인의 행복에서 대리만족을 느끼는 날입니다. 함께 기뻐하세요. 공감이 기쁨을 배가합니다.;horoscope_pisces.png
Horoscope;H_PI_141;신비주의 탐구;오늘 물고기자리는 신비주의와 밀교를 깊이 탐구합니다. 비밀을 배우세요. 밀교가 숨겨진 지혜입니다.;horoscope_pisces.png
Horoscope;H_PI_142;타로 리딩;물고기자리가 타로 카드로 미래를 읽는 날입니다. 카드를 펼치세요. 타로가 무의식을 비춥니다.;horoscope_pisces.png
Horoscope;H_PI_143;점성술 깨달음;오늘은 물고기자리가 점성술의 깊은 의미를 깨닫습니다. 별을 읽으세요. 별이 운명을 알려줍니다.;horoscope_pisces.png
Horoscope;H_PI_144;수정 명상;물고기자리가 수정을 이용한 명상으로 에너지를 정화하는 날입니다. 수정을 사용하세요. 수정이 에너지를 조율합니다.;horoscope_pisces.png
Horoscope;H_PI_145;차크라 개방;오늘 물고기자리는 차크라가 모두 개방되어 에너지가 흐릅니다. 에너지를 느끼세요. 차크라가 통로입니다.;horoscope_pisces.png
Horoscope;H_PI_146;영혼 여행;물고기자리가 명상 중 영혼 여행을 경험하는 날입니다. 여행하세요. 영혼이 자유롭습니다.;horoscope_pisces.png
Horoscope;H_PI_147;전생 기억;오늘은 물고기자리가 전생의 기억을 떠올립니다. 기억하세요. 전생이 현생을 설명합니다.;horoscope_pisces.png
Horoscope;H_PI_148;카르마 정화;물고기자리가 카르마를 정화하고 해방되는 날입니다. 정화하세요. 정화가 자유입니다.;horoscope_pisces.png
Horoscope;H_PI_149;니르바나 체험;오늘 물고기자리는 순간적으로 니르바나를 체험합니다. 초월하세요. 니르바나가 궁극입니다.;horoscope_pisces.png
Horoscope;H_PI_150;우주와 하나;물고기자리가 우주와 하나됨을 느끼는 날입니다. 하나되세요. 하나됨이 진리입니다.;horoscope_pisces.png
Horoscope;H_PI_151;물의 마법사;오늘 물고기자리는 물의 마법사처럼 원소를 다룹니다. 마법을 부리세요. 마법이 현실입니다.;horoscope_pisces.png
Horoscope;H_PI_152;연금술의 비밀;물고기자리가 연금술의 비밀을 이해하는 날입니다. 변환하세요. 연금술이 변화의 기술입니다.;horoscope_pisces.png
Horoscope;H_PI_153;달의 아이;오늘은 물고기자리가 달의 리듬과 완전히 동조합니다. 달을 따르세요. 달이 당신의 친구입니다.;horoscope_pisces.png
Horoscope;H_PI_154;조수간만의 힘;물고기자리가 조수간만의 힘처럼 강한 영향력을 발휘하는 날입니다. 영향을 주세요. 조석이 세계를 움직입니다.;horoscope_pisces.png
Horoscope;H_PI_155;안개 속 지혜;오늘 물고기자리는 안개 속에서 지혜를 발견합니다. 모호함을 받아들이세요. 안개가 신비입니다.;horoscope_pisces.png
Horoscope;H_PI_156;무지개 다리;물고기자리가 무지개 다리를 건너 두 세계를 연결하는 날입니다. 중재하세요. 무지개가 다리입니다.;horoscope_pisces.png
Horoscope;H_PI_157;수중 궁전;오늘은 물고기자리가 수중 궁전 같은 내면 세계를 가집니다. 내면으로 들어가세요. 내면이 궁전입니다.;horoscope_pisces.png
Horoscope;H_PI_158;인어의 노래;물고기자리가 인어처럼 아름다운 노래로 마음을 사로잡는 날입니다. 노래하세요. 노래가 매혹입니다.;horoscope_pisces.png
Horoscope;H_PI_159;깊은 잠수;오늘 물고기자리는 의식의 깊은 곳으로 잠수합니다. 잠수하세요. 깊이가 보물입니다.;horoscope_pisces.png
Horoscope;H_PI_160;표면 장력 돌파;물고기자리가 표면 장력을 돌파하고 새로운 차원으로 가는 날입니다. 돌파하세요. 돌파가 진화입니다.;horoscope_pisces.png
Horoscope;H_PI_161;색채 치료;오늘 물고기자리는 색채 치료로 마음을 치유합니다. 색을 사용하세요. 색채가 치료입니다.;horoscope_pisces.png
Horoscope;H_PI_162;소리 명상;물고기자리가 소리 명상으로 깊은 평화를 느끼는 날입니다. 소리에 집중하세요. 소리가 명상입니다.;horoscope_pisces.png
Horoscope;H_PI_163;향기로운 기억;오늘은 물고기자리가 향기를 통해 소중한 기억을 떠올립니다. 향기를 맡으세요. 향기가 기억입니다.;horoscope_pisces.png
Horoscope;H_PI_164;촉감의 세계;물고기자리가 촉감을 통해 세상을 새롭게 느끼는 날입니다. 만져보세요. 촉감이 연결입니다.;horoscope_pisces.png
Horoscope;H_PI_165;맛의 명상;오늘 물고기자리는 음식의 맛을 명상적으로 음미합니다. 천천히 먹으세요. 맛이 현재입니다.;horoscope_pisces.png
Horoscope;H_PI_166;오감 통합;물고기자리의 오감이 완벽히 통합되어 공감각을 경험하는 날입니다. 감각을 열어두세요. 통합이 초감각입니다.;horoscope_pisces.png
Horoscope;H_PI_167;육감 발휘;오늘은 물고기자리의 육감이 특히 예리합니다. 육감을 믿으세요. 육감이 진실입니다.;horoscope_pisces.png
Horoscope;H_PI_168;에너지 감지;물고기자리가 보이지 않는 에너지를 감지하는 날입니다. 에너지를 느끼세요. 에너지가 실재입니다.;horoscope_pisces.png
Horoscope;H_PI_169;아우라 보기;오늘 물고기자리는 타인의 아우라를 볼 수 있습니다. 오라를 관찰하세요. 오라가 진실을 드러냅니다.;horoscope_pisces.png
Horoscope;H_PI_170;기(氣) 느끼기;물고기자리가 기(氣)의 흐름을 느끼고 조절하는 날입니다. 기를 느끼세요. 기가 생명력입니다.;horoscope_pisces.png
Horoscope;H_PI_171;변신의 마법;오늘 물고기자리는 물이 형태를 바꾸듯 자유롭게 변신합니다. 변신하세요. 변신이 적응입니다.;horoscope_pisces.png
Horoscope;H_PI_172;융합의 재능;물고기자리가 서로 다른 것들을 융합하는 재능을 발휘하는 날입니다. 융합하세요. 융합이 창조입니다.;horoscope_pisces.png
Horoscope;H_PI_173;경계 해체;오늘은 물고기자리가 모든 경계를 해체하고 하나됩니다. 경계를 없애세요. 해체가 통합입니다.;horoscope_pisces.png
Horoscope;H_PI_174;이중성 포용;물고기자리가 이중성과 모순을 포용하는 날입니다. 양극을 받아들이세요. 이중성이 완전함입니다.;horoscope_pisces.png
Horoscope;H_PI_175;변증법적 사고;오늘 물고기자리는 변증법적 사고로 모순을 통합합니다. 변증법을 사용하세요. 모순이 발전입니다.;horoscope_pisces.png
Horoscope;H_PI_176;양극 통합;물고기자리가 양극단을 통합하여 완전함에 이르는 날입니다. 통합하세요. 양극 통합이 완성입니다.;horoscope_pisces.png
Horoscope;H_PI_177;카멜레온 능력;오늘은 물고기자리가 카멜레온처럼 어떤 환경에도 적응합니다. 적응하세요. 적응이 생존입니다.;horoscope_pisces.png
Horoscope;H_PI_178;유연성 최대;물고기자리의 유연성이 최대치에 달하는 날입니다. 유연하세요. 유연함이 강함입니다.;horoscope_pisces.png
Horoscope;H_PI_179;무형의 힘;오늘 물고기자리는 무형의 힘이 유형의 힘보다 강함을 깨닫습니다. 무형을 믿으세요. 보이지 않는 것이 진정한 힘입니다.;horoscope_pisces.png
Horoscope;H_PI_180;물처럼 강하게;물고기자리가 물처럼 부드러우면서도 강한 힘을 발휘하는 날입니다. 물처럼 되세요. 물이 바위를 뚫습니다.;horoscope_pisces.png
Horoscope;H_PI_181;집합 무의식 접속;오늘 물고기자리는 융의 집합 무의식에 접속합니다. 무의식을 탐험하세요. 무의식이 보편적 지혜입니다.;horoscope_pisces.png
Horoscope;H_PI_182;원형 만남;물고기자리가 원형과 만나 깊은 통찰을 얻는 날입니다. 원형을 만나세요. 원형이 근원입니다.;horoscope_pisces.png
Horoscope;H_PI_183;신화적 사고;오늘은 물고기자리가 신화적 사고로 세상을 이해합니다. 신화를 살아내세요. 신화가 진리입니다.;horoscope_pisces.png
Horoscope;H_PI_184;상징의 이해;물고기자리가 상징의 깊은 의미를 이해하는 날입니다. 상징을 읽으세요. 상징이 언어입니다.;horoscope_pisces.png
Horoscope;H_PI_185;비유의 힘;오늘 물고기자리는 비유와 은유로 진실을 전합니다. 비유하세요. 비유가 이해를 돕습니다.;horoscope_pisces.png
Horoscope;H_PI_186;우화의 교훈;물고기자리가 우화에서 깊은 교훈을 얻는 날입니다. 이야기를 들으세요. 우화가 지혜입니다.;horoscope_pisces.png
Horoscope;H_PI_187;동화 속 진실;오늘은 물고기자리가 동화 속에 숨겨진 진실을 발견합니다. 동화를 읽으세요. 동화가 심오한 진리입니다.;horoscope_pisces.png
Horoscope;H_PI_188;전설 창조;물고기자리가 자신만의 전설을 창조하는 날입니다. 전설을 쓰세요. 당신이 전설입니다.;horoscope_pisces.png
Horoscope;H_PI_189;서사시적 삶;오늘 물고기자리의 삶이 서사시처럼 장대해집니다. 서사를 살아내세요. 삶이 서사시입니다.;horoscope_pisces.png
Horoscope;H_PI_190;신화가 된 존재;물고기자리가 신화적 존재가 되는 날입니다. 신화가 되세요. 당신이 신화입니다.;horoscope_pisces.png
Horoscope;H_PI_191;물병자리 시대의 영혼;오늘 물고기자리는 새로운 시대를 영적으로 준비합니다. 준비하세요. 새 시대가 옵니다.;horoscope_pisces.png
Horoscope;H_PI_192;종말과 시작;물고기자리가 황도대의 마지막이자 새로운 시작을 체현하는 날입니다. 끝이자 시작입니다. 순환이 영원입니다.;horoscope_pisces.png
Horoscope;H_PI_193;만물의 귀결;오늘은 물고기자리에게 만물이 귀결되는 것을 느낍니다. 받아들이세요. 당신이 끝이자 완성입니다.;horoscope_pisces.png
Horoscope;H_PI_194;용해와 통합;물고기자리가 모든 것을 용해하고 통합하는 날입니다. 용해하세요. 용해가 하나됨입니다.;horoscope_pisces.png
Horoscope;H_PI_195;대우주 소우주;오늘 물고기자리는 자신이 대우주이자 소우주임을 깨닫습니다. 우주이세요. 당신이 우주입니다.;horoscope_pisces.png
Horoscope;H_PI_196;무한한 사랑;물고기자리가 무한하고 조건 없는 사랑을 체현하는 날입니다. 사랑하세요. 사랑이 전부입니다.;horoscope_pisces.png
Horoscope;H_PI_197;완전한 공감;오늘은 물고기자리가 모든 존재와 완전히 공감합니다. 하나되세요. 공감이 연결입니다.;horoscope_pisces.png
Horoscope;H_PI_198;초월적 자비;물고기자리가 초월적 자비로 모든 것을 포용하는 날입니다. 자비로우세요. 자비가 최고의 덕입니다.;horoscope_pisces.png
Horoscope;H_PI_199;해탈의 경지;오늘 물고기자리는 해탈의 경지에 이릅니다. 해탈하세요. 해탈이 자유입니다.;horoscope_pisces.png
Horoscope;H_PI_200;완벽한 물고기자리;물고기자리에게 모든 면에서 완벽하고 초월적인 하루가 펼쳐집니다. 완전함을 누리세요. 오늘 당신은 완벽합니다.;horoscope_pisces.png
